<?xml version="1.0" encoding="ISO-8859-1" ?>
<forms xmlns="http://www.1ci.de"
	xmlns:xsi="http://www.w3.org/2001/XMLSchema-instance"
	xsi:schemaLocation="http://www.1ci.de ../../../etc/FORMS.xsd">

	<form id="form1">
		<name>registerform</name>
		<description>Formular zum registrieren</description>
		<formversion>0.1</formversion>
		<field name="name" required="true">
			<description>Name</description>
			<type>string</type>
		</field>
		<field name="vorname" required="true">
			<description>Vorname</description>
			<type>string</type>
		</field>
		<field name="email" required="true">
			<description>Email</description>
			<type>string</type>
			<constraints>
				<constraint type="format">.+@.+\..+</constraint>
			</constraints>
		</field>
		<field name="strasse">
			<description>Strasse</description>
			<type>string</type>
		</field>
		<field name="plz">
			<description>PLZ</description>
			<type>string</type>
			<constraints>
				<constraint type="format" description="xxxxx">\d{5}</constraint>
			</constraints>
		</field>
		<field name="ort">
			<description>Ort</description>
			<type>string</type>
		</field>
		<field name="foto">
			<description>Passfoto</description>
			<type>file</type>
		</field>
	</form>
	
</forms>
